{
  "input_profile":
  {
    "explicit": ["deps-lock.json","deps.edn","docs\/evidence\/adr-capture\/tei-enrichment-warning.edn","docs\/evidence\/adr-inputs\/tei-enrichment-warning.edn","fixtures\/tei\/warnings\/transcription-enrichment-undeclared.xml","flake.lock","flake.nix","nix\/tei-profile-artifacts.nix","schemas\/tei-profile.sch","src\/abc\/tools\/evidence_io.clj","src\/abc\/tools\/path_containment.clj","src\/abc\/tools\/schematron.clj","test\/abc\/test_fs.clj","test\/abc\/tools\/schematron_test.clj","tests.edn"],
    "kind": "repo-files-v1",
    "roots": []
  },
  "inputs":
  {
    "deps-lock.json": "sha256:3ac5409cf04e87a2c4ce96ed38d1ee4622ab30d9f7dbcdbafa79f26718f74957",
    "deps.edn": "sha256:09c8675048f7fb9d423ca985189c952a9da00ded4f2d5587bd19acb8128228b8",
    "docs\/evidence\/adr-capture\/tei-enrichment-warning.edn": "sha256:9788226761e9b9ec67e72c224b9d19425738e538ddbe5c49312c5a8f108f38f7",
    "docs\/evidence\/adr-inputs\/tei-enrichment-warning.edn": "sha256:3d4eca3249c48a9a35a67b5b389736c4168a20220628ab4a79ecb5ee0345208b",
    "fixtures\/tei\/warnings\/transcription-enrichment-undeclared.xml": "sha256:9d9a346a209ed3a09086305db2dcf4e3e58c35a1c19ca83a5b619e1bb058228e",
    "flake.lock": "sha256:fcd0765d3334ed461aab083a644ca1a12d57c0a75c12eaca70391af8daf8201c",
    "flake.nix": "sha256:744054ae56f87fed6ded703604bb9fbb93d0655274b6183c4a0d6e696650d3e4",
    "nix\/tei-profile-artifacts.nix": "sha256:5b4f1034b8fc6191903898df52b54c7307751157af08334500e8288d69eeaab2",
    "schemas\/tei-profile.sch": "sha256:608dcce45ba2acd490706691c4e38f885615176744f0db10a5a46aa96fa4da8a",
    "src\/abc\/tools\/evidence_io.clj": "sha256:8d93b8ce1bf5983601c50cdaee92c6f3bfe5efff97afe3dc353ded047b11ea46",
    "src\/abc\/tools\/path_containment.clj": "sha256:7fc7708e79acd8131d2f229146bf488fc17ec8da484e2a6a6a6717c9b2ebd8a3",
    "src\/abc\/tools\/schematron.clj": "sha256:c1541ab6d3859b39601dafba06808b1cb95564d664875f375413ef64cbfd3737",
    "test\/abc\/test_fs.clj": "sha256:97719929a21bd6a85214f9423a12b3e43c291cc2cdb564e3edbfef638614aaa9",
    "test\/abc\/tools\/schematron_test.clj": "sha256:e1f8c4115c641f6acbc07618c81d98d6b3166ebc05d1d3b908cb953b6f6e2923",
    "tests.edn": "sha256:de794121a85f6ac6a5bd3fa8cf3ce174630a4356819c1172ccdc76d093fa700e"
  },
  "observations":
  {
    "tei-enrichment-warning-contract-passes":
    {
      "details":
      {
        "command_id": "tei-enrichment-warning",
        "environment_policy": "nix-local-v1",
        "exit_code": 0,
        "nix_system": "x86_64-linux",
        "nix_version": "nix (Determinate Nix 3.21.7) 2.34.8"
      },
      "value": true
    }
  },
  "producer":
  {
    "command": "\"bash\" \"--noprofile\" \"--norc\" \"-c\" \"system=$(nix eval --impure --raw --expr builtins.currentSystem); exec nix build --no-link \\\".#checks.${system}.adr-evidence-tei-enrichment-warning\\\"\"",
    "revision": "b2a6773452506ee82b633aa379288fa115996a30",
    "tool": "bash"
  },
  "schema_version": "abc-adr-evidence-run-v1"
}