{
  "input_profile":
  {
    "explicit": ["bin\/kaocha","docs\/evidence\/adr-capture\/person-drift-contract.edn","docs\/evidence\/adr-inputs\/person-drift-contract.edn","examples\/v0\/example-persons\/_events\/sha256:550c55dbfed12ce9b6de833a75c8b03e8a01bf3047c17ced494e87db0f4ee747.json","examples\/v0\/example-persons\/_indexes\/000879.json","examples\/v0\/example-persons\/_indexes\/abc-000000000001.json","examples\/v0\/example-persons\/_indexes\/abc-000000000002.json","schemas\/manifest.shacl.ttl","schemas\/person-drift-event.schema.json","schemas\/person-drift-index.schema.json"],
    "kind": "clojure-test-v1",
    "roots": ["abc.tools.temporal-evidence-input-test"]
  },
  "inputs":
  {
    "bin\/kaocha": "sha256:1b16c6c62fc7bebe016194f77f8db944ec33aae46df032af7427731f83156faf",
    "docs\/evidence\/adr-capture\/person-drift-contract.edn": "sha256:20c0abfe1983ce854e113a529381e7df252d6764e22d97d816649823c1f6dcff",
    "docs\/evidence\/adr-inputs\/person-drift-contract.edn": "sha256:3fe4fd99693e0c0ed2b379f312762045b6d5556d18e48b4beb7e3f43f1b523fe",
    "examples\/v0\/example-persons\/_events\/sha256:550c55dbfed12ce9b6de833a75c8b03e8a01bf3047c17ced494e87db0f4ee747.json": "sha256:2a7dd0af704d00209cd07f80b09e4d6904ed7e73330a856ac11fbd547d3e90d0",
    "examples\/v0\/example-persons\/_indexes\/000879.json": "sha256:92ac336e9c77d57ffa6c5b04da7f732cae2d5871d16f62c23fadca072bc3825e",
    "examples\/v0\/example-persons\/_indexes\/abc-000000000001.json": "sha256:ec1ab22dc2fbd50be6fe208d4593c3dbfbe9bc1a709150379d5bd41846c9cd55",
    "examples\/v0\/example-persons\/_indexes\/abc-000000000002.json": "sha256:a763558c9d2c1c0661090bad5a3ab788301093ede12e195e36dc0bdd7c8bcb42",
    "schemas\/manifest.shacl.ttl": "sha256:1a27dea35abc426a3d94802abd76902d7cc471f71a3526f1c1da246e320df852",
    "schemas\/person-drift-event.schema.json": "sha256:6f0913c9365535c880df285bfcff5b2128eefa5a8b8c6744aa4826c988f4a4bd",
    "schemas\/person-drift-index.schema.json": "sha256:86460ff14b5efeffc4fd5fc2f3b061340744397a2aba43aa6de1efb479c88ccf",
    "src\/abc\/git.clj": "sha256:1c2c88483e6b758eb802c40bbe9f6b89aff350274a40db74eb500d406b68d0bd",
    "src\/abc\/tools\/aat_parser_ir_compat.clj": "sha256:c454a9689bb53b0aedcbf053b464ab78843e459ed77d2c4f654cccb6dbc9504c",
    "src\/abc\/tools\/adr_evidence_runtime_inputs.clj": "sha256:21baaf7ae1b36e8e04604335b71ee337c1e42047d4f0623bcc833cf22d825536",
    "src\/abc\/tools\/analysis_identity.clj": "sha256:a4e89b3fe25b0e4a236a7932c47845caf467bdc873555e35a9da121ea65d9af4",
    "src\/abc\/tools\/aozora_csv.clj": "sha256:2ed5ae1b94a4e9230d8954ed98b3820cb0ca2f8145025b7b1fc279fccb9e1835",
    "src\/abc\/tools\/aozora_history_audit.clj": "sha256:c03d320bf612519bdac183ce0e982b1dcdb014ac36eeef82eed7dbaf5b4e1af3",
    "src\/abc\/tools\/aozora_ingest.clj": "sha256:c3ec11efd548e8cedb33a3cb843acfa1290319989847c987d488d11fd26e7145",
    "src\/abc\/tools\/cli.clj": "sha256:e62f426f2f0f741ae6195f02bb6e6cb0289f27d8785569769b0b46c031965054",
    "src\/abc\/tools\/edn_registry.clj": "sha256:4d75f858bd14f6808d110ad9c252e643fcebfc3176eda65a3a6b7bfc9651eafb",
    "src\/abc\/tools\/evidence_io.clj": "sha256:8d93b8ce1bf5983601c50cdaee92c6f3bfe5efff97afe3dc353ded047b11ea46",
    "src\/abc\/tools\/files.clj": "sha256:40f1dd9eca5d539b39b1ec0be4e422f6701060ebada793c8f99dcb8d4b161ce3",
    "src\/abc\/tools\/hash.clj": "sha256:e49befc2ce08401bb3161af5cedcf0555eec6a639510ca31445da30b32e2cfb5",
    "src\/abc\/tools\/iiif.clj": "sha256:dedf8ca77c9818c79e1d55c5b3e2a0143345d5b63225b16ce36040625ce0eaf0",
    "src\/abc\/tools\/jcs.clj": "sha256:4a35835c6b905a54e9b72f78d4e9f4f8d8a19567c6b4b18500d04770d8493fc4",
    "src\/abc\/tools\/json.clj": "sha256:9a67548ddfd43970ef2c337ae885edc25f5ddc900f910586e6b82fe9b5c257c9",
    "src\/abc\/tools\/linked_art.clj": "sha256:9bae5bb1f7fca74a6d1083b41cc76730d65dfdb01f414a25fa33c4770bc883fd",
    "src\/abc\/tools\/logging.clj": "sha256:d4f0de64cb52fe99cab2761a1ca5b1fd427e2c201d180a153bd5cf76a47bade7",
    "src\/abc\/tools\/malli.clj": "sha256:16c04c051ac5829e36b7d0e7707c0057cef22ac2c20f778ad08f0d3b40df471e",
    "src\/abc\/tools\/manifest.clj": "sha256:ffeaad0f5073f8b8085562c854d76ea893fbc78669246e3601aa187e8a7006b6",
    "src\/abc\/tools\/manifest_index.clj": "sha256:5673957a889cb79df2710aafec2b0b5999c378215f4ec1120f08974d2faeaa59",
    "src\/abc\/tools\/manifest_to_rdf.clj": "sha256:bb38316e7aa5e6c0e0aeb6491b39807cb1c40ac3aef1b27a24cc6514799c63e9",
    "src\/abc\/tools\/materialize_analysis.clj": "sha256:b07c53b5fa50c8149a98afd0a4fd3112c5293e86480a9359ac5acaacdcc94c41",
    "src\/abc\/tools\/materialize_annotations.clj": "sha256:503731c1e7e61c2b3bf5770426149144638570dd2ac76fdd51935b943e7b8214",
    "src\/abc\/tools\/materialize_import.clj": "sha256:ba2daa956fbfdcf36b408cfbc588bc0a1d15c843c3c33953f43bf4025c45ac1b",
    "src\/abc\/tools\/materialize_publication.clj": "sha256:8a891e91f2ab5e4e9f22e14ff95248e4aeaf526182888ff384505ccdaa53bf9a",
    "src\/abc\/tools\/materialize_tokenized.clj": "sha256:f31513ee4f20fea248eaf667811ebb12057e7eb7591fb7e04a6d08c58fb16464",
    "src\/abc\/tools\/metadata_record.clj": "sha256:b87fd5dbe5831983dc618849593fc08bba2d4bd6a2dbf447b88738253015f36f",
    "src\/abc\/tools\/parallel.clj": "sha256:51b1105b04a52d45a6fb3811e4b3c53b1b44162fd81f5d68ab412039b31a243c",
    "src\/abc\/tools\/parser_evidence.clj": "sha256:5d735ad135dd1d991222a18ebe46ca62e862d54835687e1581c47b4f3a9aef78",
    "src\/abc\/tools\/parser_ir_plaintext.clj": "sha256:d21da8a17ef2e1d132ba7e05ce6c0d17bd4154d4c7c4bf9b9f72114e087f7d87",
    "src\/abc\/tools\/parser_ir_publication_policy.clj": "sha256:f2315b7375ba189077ee34eee402e18ee711e84c5abcd92c60ef9ad91020d6f8",
    "src\/abc\/tools\/parser_ir_publication_whitespace.clj": "sha256:649c5ad727df611eed3271856873f642066f5f62aa8c3648d6072a4ff467f8ad",
    "src\/abc\/tools\/parser_ir_sentence_policy.clj": "sha256:a2c91542a06fbd97f4f0433127143bf0645d3b1828f7d13dfc2b38c0cb1bdd6b",
    "src\/abc\/tools\/parser_ir_tei.clj": "sha256:6683b4a741ac1ea1967653f1f218fd1af804eb60ec950a26858ae057502d32ec",
    "src\/abc\/tools\/parser_maintenance_evidence.clj": "sha256:ecf976ebc961c9bab66aaa51c9ebd54f3a9fa15035795eaa58e4da1d242e3b46",
    "src\/abc\/tools\/path_containment.clj": "sha256:7fc7708e79acd8131d2f229146bf488fc17ec8da484e2a6a6a6717c9b2ebd8a3",
    "src\/abc\/tools\/person_drift.clj": "sha256:9a65f270e7df41a54a2b31c596f6593282f71f4d18622b39d9aafcb44e099b23",
    "src\/abc\/tools\/person_drift_history.clj": "sha256:eb47bb708709609fdd79ef329f607a216235d0c192f680bbe89c58aa04756bc6",
    "src\/abc\/tools\/person_record.clj": "sha256:e9b2323dc7adba721d269bebab37bc9f13c4b89d3e504f0a6f63ff3bfb95b974",
    "src\/abc\/tools\/publication_policy.clj": "sha256:d47280892c3bc350db264e86aff8eb5907f872d8a99508719103ec616cb17080",
    "src\/abc\/tools\/rdf_prefixes.clj": "sha256:464ac0a7365d92a37084664c1af77aa5525c6eabbc86fad4358ff2637d993e29",
    "src\/abc\/tools\/schema.clj": "sha256:51be6926333fc14d27473dc845a1f3a27ca509aa8148be54928bf265350ff871",
    "src\/abc\/tools\/schematron.clj": "sha256:c1541ab6d3859b39601dafba06808b1cb95564d664875f375413ef64cbfd3737",
    "src\/abc\/tools\/shacl.clj": "sha256:5d8a801cafdd87375519facda7d22e18380168f777bc216773a85d8de78a77ce",
    "src\/abc\/tools\/snapshot_index.clj": "sha256:c2a857650a79afe8fa90d8d9343efdca6cc1742cb4f59c1103b875f675ec40a8",
    "src\/abc\/tools\/source_region_contract.clj": "sha256:5d9e4917ec852ba237dad1b989d62269e1cff77f5513b4469eaf9ad73b7696e6",
    "src\/abc\/tools\/tei.clj": "sha256:99f28746391ade7573366617521848fe2eb5a2b7bc76d56925b0ac61c43f1564",
    "src\/abc\/tools\/tei_header.clj": "sha256:5cd035450cdbf1e1eceb7de02161629087a5241f543291f30a8ae4a0b9bd9b3e",
    "src\/abc\/tools\/validate_corpus.clj": "sha256:2923a63a97e589cf81881539f6719cb5917c86b85ad17c63ff976acdca8714e3",
    "src\/abc\/tools\/validate_design_bundle.clj": "sha256:4b7614e6d78bdf08287926f5fdc46ce59413378e3051f84b09f62d15422bd07b",
    "test\/abc\/sim\/oracle.clj": "sha256:b25546934d3a9c1765bb12af27f37155a292c67a8bacbbd089835988dccb4728",
    "test\/abc\/sim\/render.clj": "sha256:bceb6a6b96fdbce4e52fa589b4977dfe076414c1b4b4b97206e04ec4f3ca6de0",
    "test\/abc\/tools\/temporal_evidence_input_test.clj": "sha256:8b99237f675d628229adea725155ba588a267c231375a966aa163f3999cb2b94"
  },
  "observations":
  {
    "person-drift-contract-passes":
    {
      "details":
      {
        "exit_code": 0
      },
      "value": true
    }
  },
  "producer":
  {
    "command": "\"bin\/kaocha\" \"--focus\" \"abc.tools.temporal-evidence-input-test\/person-drift-contract\"",
    "revision": "49578e63fa07670692f2d566ac74f37d77185bd8",
    "tool": "bin\/kaocha"
  },
  "schema_version": "abc-adr-evidence-run-v1"
}