{
  "input_profile":
  {
    "explicit": ["deps-lock.json","deps.edn","docs\/evidence\/adr-capture\/aozora-history-audit-cli.edn","docs\/evidence\/adr-inputs\/aozora-history-audit-cli.edn","flake.lock","flake.nix","schemas\/manifest.shacl.ttl","schemas\/metadata-record.schema.json","schemas\/person-drift-event.schema.json","schemas\/person-drift-index.schema.json","schemas\/person-record.schema.json","src\/abc\/git.clj","src\/abc\/tools\/aozora_csv.clj","src\/abc\/tools\/aozora_history_audit.clj","src\/abc\/tools\/aozora_ingest.clj","src\/abc\/tools\/cli.clj","src\/abc\/tools\/evidence_io.clj","src\/abc\/tools\/files.clj","src\/abc\/tools\/hash.clj","src\/abc\/tools\/jcs.clj","src\/abc\/tools\/json.clj","src\/abc\/tools\/logging.clj","src\/abc\/tools\/malli.clj","src\/abc\/tools\/manifest.clj","src\/abc\/tools\/manifest_to_rdf.clj","src\/abc\/tools\/metadata_record.clj","src\/abc\/tools\/path_containment.clj","src\/abc\/tools\/person_drift.clj","src\/abc\/tools\/person_drift_history.clj","src\/abc\/tools\/person_record.clj","src\/abc\/tools\/rdf_prefixes.clj","src\/abc\/tools\/schema.clj","src\/abc\/tools\/shacl.clj","src\/abc\/tools\/validate_corpus.clj","test\/abc\/sim\/oracle.clj","test\/abc\/sim\/render.clj","test\/abc\/tools\/aozora_history_audit_test.clj","tests.edn"],
    "kind": "repo-files-v1",
    "roots": []
  },
  "inputs":
  {
    "deps-lock.json": "sha256:3ac5409cf04e87a2c4ce96ed38d1ee4622ab30d9f7dbcdbafa79f26718f74957",
    "deps.edn": "sha256:09c8675048f7fb9d423ca985189c952a9da00ded4f2d5587bd19acb8128228b8",
    "docs\/evidence\/adr-capture\/aozora-history-audit-cli.edn": "sha256:caad1ef7ca886797df3ef339461f2877792f7f09b239a5a953b2b8279f137c4a",
    "docs\/evidence\/adr-inputs\/aozora-history-audit-cli.edn": "sha256:63d5b3e0ec8a94520a085bb0038f786bf7f3671c5858018aa30840bb8e12798b",
    "flake.lock": "sha256:fcd0765d3334ed461aab083a644ca1a12d57c0a75c12eaca70391af8daf8201c",
    "flake.nix": "sha256:744054ae56f87fed6ded703604bb9fbb93d0655274b6183c4a0d6e696650d3e4",
    "schemas\/manifest.shacl.ttl": "sha256:1a27dea35abc426a3d94802abd76902d7cc471f71a3526f1c1da246e320df852",
    "schemas\/metadata-record.schema.json": "sha256:cb1c773f86f0ae16f613b342be80b87f8a7829417bcdcd36b5737eeab6a85129",
    "schemas\/person-drift-event.schema.json": "sha256:6f0913c9365535c880df285bfcff5b2128eefa5a8b8c6744aa4826c988f4a4bd",
    "schemas\/person-drift-index.schema.json": "sha256:86460ff14b5efeffc4fd5fc2f3b061340744397a2aba43aa6de1efb479c88ccf",
    "schemas\/person-record.schema.json": "sha256:35e5c3aac75d03f7bf228b05e331dea4df3e791256f14fa8b498fcd405888bcb",
    "src\/abc\/git.clj": "sha256:1c2c88483e6b758eb802c40bbe9f6b89aff350274a40db74eb500d406b68d0bd",
    "src\/abc\/tools\/aozora_csv.clj": "sha256:2ed5ae1b94a4e9230d8954ed98b3820cb0ca2f8145025b7b1fc279fccb9e1835",
    "src\/abc\/tools\/aozora_history_audit.clj": "sha256:c03d320bf612519bdac183ce0e982b1dcdb014ac36eeef82eed7dbaf5b4e1af3",
    "src\/abc\/tools\/aozora_ingest.clj": "sha256:c3ec11efd548e8cedb33a3cb843acfa1290319989847c987d488d11fd26e7145",
    "src\/abc\/tools\/cli.clj": "sha256:e62f426f2f0f741ae6195f02bb6e6cb0289f27d8785569769b0b46c031965054",
    "src\/abc\/tools\/evidence_io.clj": "sha256:8d93b8ce1bf5983601c50cdaee92c6f3bfe5efff97afe3dc353ded047b11ea46",
    "src\/abc\/tools\/files.clj": "sha256:40f1dd9eca5d539b39b1ec0be4e422f6701060ebada793c8f99dcb8d4b161ce3",
    "src\/abc\/tools\/hash.clj": "sha256:e49befc2ce08401bb3161af5cedcf0555eec6a639510ca31445da30b32e2cfb5",
    "src\/abc\/tools\/jcs.clj": "sha256:4a35835c6b905a54e9b72f78d4e9f4f8d8a19567c6b4b18500d04770d8493fc4",
    "src\/abc\/tools\/json.clj": "sha256:9a67548ddfd43970ef2c337ae885edc25f5ddc900f910586e6b82fe9b5c257c9",
    "src\/abc\/tools\/logging.clj": "sha256:d4f0de64cb52fe99cab2761a1ca5b1fd427e2c201d180a153bd5cf76a47bade7",
    "src\/abc\/tools\/malli.clj": "sha256:16c04c051ac5829e36b7d0e7707c0057cef22ac2c20f778ad08f0d3b40df471e",
    "src\/abc\/tools\/manifest.clj": "sha256:ffeaad0f5073f8b8085562c854d76ea893fbc78669246e3601aa187e8a7006b6",
    "src\/abc\/tools\/manifest_to_rdf.clj": "sha256:bb38316e7aa5e6c0e0aeb6491b39807cb1c40ac3aef1b27a24cc6514799c63e9",
    "src\/abc\/tools\/metadata_record.clj": "sha256:b87fd5dbe5831983dc618849593fc08bba2d4bd6a2dbf447b88738253015f36f",
    "src\/abc\/tools\/path_containment.clj": "sha256:7fc7708e79acd8131d2f229146bf488fc17ec8da484e2a6a6a6717c9b2ebd8a3",
    "src\/abc\/tools\/person_drift.clj": "sha256:9a65f270e7df41a54a2b31c596f6593282f71f4d18622b39d9aafcb44e099b23",
    "src\/abc\/tools\/person_drift_history.clj": "sha256:eb47bb708709609fdd79ef329f607a216235d0c192f680bbe89c58aa04756bc6",
    "src\/abc\/tools\/person_record.clj": "sha256:e9b2323dc7adba721d269bebab37bc9f13c4b89d3e504f0a6f63ff3bfb95b974",
    "src\/abc\/tools\/rdf_prefixes.clj": "sha256:464ac0a7365d92a37084664c1af77aa5525c6eabbc86fad4358ff2637d993e29",
    "src\/abc\/tools\/schema.clj": "sha256:51be6926333fc14d27473dc845a1f3a27ca509aa8148be54928bf265350ff871",
    "src\/abc\/tools\/shacl.clj": "sha256:5d8a801cafdd87375519facda7d22e18380168f777bc216773a85d8de78a77ce",
    "src\/abc\/tools\/validate_corpus.clj": "sha256:2923a63a97e589cf81881539f6719cb5917c86b85ad17c63ff976acdca8714e3",
    "test\/abc\/sim\/oracle.clj": "sha256:b25546934d3a9c1765bb12af27f37155a292c67a8bacbbd089835988dccb4728",
    "test\/abc\/sim\/render.clj": "sha256:bceb6a6b96fdbce4e52fa589b4977dfe076414c1b4b4b97206e04ec4f3ca6de0",
    "test\/abc\/tools\/aozora_history_audit_test.clj": "sha256:31f352cef49c17c6e2b46ac467389552546755d6edc2ea084950bd06783f013a",
    "tests.edn": "sha256:de794121a85f6ac6a5bd3fa8cf3ce174630a4356819c1172ccdc76d093fa700e"
  },
  "observations":
  {
    "aozora-history-audit-cli-passes":
    {
      "details":
      {
        "command_id": "aozora-history-audit-cli",
        "environment_policy": "nix-local-v1",
        "exit_code": 0,
        "nix_system": "x86_64-linux",
        "nix_version": "nix (Determinate Nix 3.21.7) 2.34.8"
      },
      "value": true
    }
  },
  "producer":
  {
    "command": "\"bash\" \"--noprofile\" \"--norc\" \"-c\" \"system=$(nix eval --impure --raw --expr builtins.currentSystem); exec nix build --no-link \\\".#checks.${system}.adr-evidence-aozora-history-audit-cli\\\"\"",
    "revision": "d3ed4275df3f42022d3bf13e8998f660795bf5ee",
    "tool": "bash"
  },
  "schema_version": "abc-adr-evidence-run-v1"
}